{
  "formatVersion": 1,
  "kind": "generated",
  "metadata": {
    "title": "Generated fixture",
    "description": "Portable package fixture.",
    "tags": ["fixture"],
    "visibilityIntent": "private",
    "origin": { "appVersion": "fixture", "exportedAt": "2026-09-26T00:00:00Z" }
  },
  "records": [],
  "source": { "engine": "svg", "code": "<svg></svg>" },
  "sonic": { "scale": "major" },
  "capabilities": { "sound": true },
  "mediaAssets": [],
  "files": []
}
